id	name	element	description	imagepath	power
93	Guru Laghima's Teachings	AIR	New growth cannot exist without first the destruction of the old.	com/avatarduel/card/image/skill/Guru Laghima's Teachings.png	3
94	Hurricane Winds	AIR	What the airbenders had lacked in skill and power they made up for in numbers.	com/avatarduel/card/image/skill/Hurricane Winds.png	3
95	Kyoshi's Triumph	AIR	A powerful gust of wind washes over the surprised Chin and strips him of all his clothes except for his underwear.	com/avatarduel/card/image/skill/Kyoshi's Triumph.png	3
96	Tornado	AIR	An Avatar-level airbender can create massive tornadoes and hurricanes at will.	com/avatarduel/card/image/skill/Tornado.png	3
97	Creeping Crystal	EARTH	Jennamiten-also known as creeping crystal- grows at remarkably fast speeds when it comes into contact with organic matter.	com/avatarduel/card/image/skill/Creeping Crystal.png	3
98	Earth Shackles	EARTH	With proper timing an earthbender can bind an opponent's arms with triangle-shaped slabs.	com/avatarduel/card/image/skill/Earth Shackles.png	3
99	Rock Bullet	EARTH	A master earthbender can launch shrapnel-like fragments of earth with great speed.	com/avatarduel/card/image/skill/Rock Bullet.png	3
100	Rockslide	EARTH	An earthbender can cause many rocks of a multitude of sizes to rain down on their opponent.	com/avatarduel/card/image/skill/Rockslide.png	3
101	Agni Kai	FIRE	A fight for one's honor and is won only when one opponent burns the other.	com/avatarduel/card/image/skill/Agni Kai.png	3
102	Dragon Fire	FIRE	Their fire was beautiful. I saw so many colors. Colors I've never imagined.	com/avatarduel/card/image/skill/Dragon Fire.png	3
103	Fire Breath	FIRE	Iroh was the last outsider to face the masters. They deemed him worthy and passed the secret onto him as well.	com/avatarduel/card/image/skill/Fire Breath.png	3
104	Raze	FIRE	From our airships we will rain fire over their lands. A fire that will destroy everything; and from the ashes a new world will be born.	com/avatarduel/card/image/skill/Raze.png	3
105	Dessication	WATER	They're called fire lilies. They only bloom a few weeks a year. And like all plants and all living things they're filled with water.	com/avatarduel/card/image/skill/Dessication.png	3
106	Ocean's Wrath	WATER	It its wrath the Ocean Spirit La laid waste to the Fire Nation's armies.	com/avatarduel/card/image/skill/Ocean's Wrath.png	3
107	Sever Bending	WATER	When he took my bending the sensation was somehow familiar. I later recognized it as my brother's bloodbending grip.	com/avatarduel/card/image/skill/Sever Bending.png	3
108	Whirlpool	WATER	The Great Serpent is trapped in the maelstrom.	com/avatarduel/card/image/skill/Whirlpool.png	3
148	Avatar Beam	ENERGY	The avatar can shoot laser beams apparently.	com/avatarduel/card/image/skill/Avatar Beam.png	3
149	Eternal Struggle	ENERGY	For ten-thousand years Raava and Vaatu fought for dominance.	com/avatarduel/card/image/skill/Eternal Struggle.png	3
150	Remove Bending	ENERGY	With his bending taken away Phoenix Lord Ozai was no longer a threat to the world.	com/avatarduel/card/image/skill/Remove Bending.png	3
151	Steal Face	ENERGY	Koh can steal any face that shows even the slightest sign of emotion in his presence.	com/avatarduel/card/image/skill/Steal Face.png	3